book,chapter,paragragh,tag
元尊,第四百四十七章 一拳轰出,"修长的手掌，终是与雷光剑影接触在了一起，顿时间火花四溅，不过，就在这一瞬间，那吴海嘴角的狰狞，忽然凝固。
他的瞳孔陡然紧缩。
因为他并没有见到鲜血溅射，周元的手掌，稳稳的抓住雷光剑尖，仿佛其上蕴含的锋利剑气对他没有丝毫伤害一般。
吱吱！
不论雷光剑影如何的挣扎，竟都是无法脱离周元的掌心。
“这？！”修炼台周围，顿时响起了诸多的骇然惊呼声。
吕嫣也是一怔，俏脸上有着一抹匪夷所思之色浮现出来。
她有点无法相信，在没有天源兵增幅的情况下，周元竟然以肉掌，接住了吴海这般凌厉的一击？
“咔嚓！”
在那无数道骇然目光中，周元的神色却是毫无波澜，手掌之上，玉光涌动，猛然一握间，竟是生生的将那雷光剑影捏碎开来。
唰！
下一瞬间，他的身影暴射而出，直接是出现在了吴海的面前。
他面无表情，五指紧握，一拳轰出。
整条手臂皮肤绽放出玉光，同时体内的源气也是如洪流般涌动。
一股可怕的力量，宛如火山一般，陡然喷发。
一拳而出，空间都是隐隐的发出了碎裂的声音。
吴海浑身汗毛倒竖，双手急忙结印，顿时源气呼啸而出，迅速的在身前形成了无数重源气防御。
砰！
然而，那些防御，当周元那绽放着玉光的拳头轰出时，几乎是顷刻间蹦碎开来。
一息不到，所有防御碎裂。
轰！
再然后，周元的拳头便是带着尖锐的音爆声，重重的落在了吴海胸膛之上。
他的面色，毫无波澜。
而吴海的眼中，有着惊骇涌现。",1
元尊,第四百五十九章 刚刚开始,"一座山峰上，巨石不断的滚落，山壁上深深的镶嵌着一道人影，巨石滚落，渐渐的将其掩盖……
而整个天地间，都是在此时变得安静下来。
一道道目光愣愣的望着这一幕，许久都有些未回过神来，谁能想到……这一次在准备得极为充分的情况下，吴海最终依然是被周元一拳轰飞……
如果说上一次，还能够以措手不及来解释，那这一次，却是连任何的借口都没有了。
先前吴海显然是倾尽了全力来抵御，但却依然没挡住周元那凶悍无匹的一拳，那一拳的威势，足以让得许多八重天的弟子都不敢小觑。
天地间的寂静，持续了半晌，最终便是被那排山倒海般响起的喝彩声所充斥。
除了陆宏一脉的弟子外，其余各峰各脉的弟子，皆是毫不吝啬的鼓掌喝彩，只因周元这以弱胜强的一局，实在是漂亮得让人感到惊艳。
要知道，在那首席之争开始前，周元的赔率几乎是最高，因为没几个人看好他，甚至，有人还觉得他会第一个出局。
但最终的事实，让得所有小觑于周元的人都是闭上了嘴巴。
望着石台中那道年轻的身影，此时此刻，不知道多少人心中对其升起了忌惮与敬畏。",1
元尊,第四百六十九章 震撼四方,"巨大的峰顶之上，一片狼藉，深深的裂痕犹如是要将那座广场一分为二，在那裂痕的尽头，乱石堆积，掩埋了袁洪的身影。
首席峰外，一片死寂。
所有的目光都是震撼的望着这一幕，自从首席之争开始到现在，袁洪一直都是从容不迫，即便是面对着周泰，吕嫣，张衍三人的联手，他都是未曾有半点的落入下风。
跟周元相比，袁洪才算是真正的所向披靡。
所以，当众多弟子在见到这无人可挡的袁洪，竟然是在此刻，被周元一拳轰飞时，那种震撼感，方才如此的强烈。
要知道，在那片刻之前，周元可是被袁洪压着打，狼狈至极。
可这短短一会，周元却是犹如脱胎换骨一般。
谁能想到，周元能够爆发出如此恐怖的力量？",1
元尊,第四百七十二章 临阵突破,"“给！我！滚！”
周元喉咙间，似是有着低沉的喝声响起，拳头微微回缩，下一刻，再度悍然挥出。
铛！
犹如是被黑色拳套所覆盖的拳头，碰撞在袁洪手掌上，宛如金铁碰撞，巨大的冲击波再度肆虐。
而也就是在此时，袁洪的瞳孔猛的一缩，因为他能够感觉到，一股无法形容的磅礴之力呼啸而来，在那种力量的倾泻下，袁洪那有着剑影若隐若现的手臂上，顿时有着细微的血痕浮现出来。
咔嚓！
整个手臂，仿佛都是在这一瞬断裂。
再然后，那无数道视线便是惊骇欲绝的见到，袁洪的身影犹如是炮弹一般从天而降。
风声在耳边急促的刮过，袁洪的面庞上，似乎也是有着惊骇浮现，他似乎是没想到，周元这一拳的威势，究竟能够强到这种程度！
他体内的天焱剑，仿佛都是在此时发出了一道凄厉的剑吟之声。
轰！
他的身影，直接是落在了首席峰峰顶，然后只听见砰砰的巨声响彻，本就摇摇欲坠的峰顶在此时彻彻底底的崩塌。
袁洪的身影，贯穿了山体，最后一直深入到了首席峰极深处。
山体塌陷，整座巨峰，都是在此时崩塌。
那般破坏力，看得诸多弟子都是倒吸一口冷气。
整个天地，寂静无声。",1
元尊,第四百七十五章 我们赢了,"他抬起头来，望着高空之外，抱拳一礼。
“圣源峰首席之争结束，请掌教赐位。”
他那雄浑的清朗声音，在这寂静无声的天地间，响彻而起。
当周元那清朗的声音响彻在天地间时，那首席峰外的寂静无声，也终于是在此时被打破，那一道道近乎呆滞般的目光，渐渐的回神……
他们的视线，望着那还在不断缓缓崩塌的首席峰，在半空处，周元凌空而立，虽然衣衫破碎略微有些狼狈，但那隐隐间散发出来的威势，却是让得诸多弟子都是微微一滞。
此时此刻，他们方才恍然间的感觉到，这个在很多人看来只是一个新弟子的周元，竟然已经在这短短一年的时间中，成长到了这种惊人的地步……
甚至，连袁洪这种级别的老牌弟子，都是败在了他的手中！
这一刻，众人方才明白过来，眼前的周元，已再不能以过往的目光去看待了……谁若是还仗着一些资历在其面前摆高高在上的姿态，恐怕真的只能是自取其辱了。",1
元尊,第四百八十一章 力挫赵烛,"众人目光紧紧的望着那对碰之处，再然后，他们的瞳孔便是猛的一缩，只见得那里，赵烛的身影略显狼狈的倒射而出。
直接是射出了百香楼，落在了外间的地面上。
落脚之处，地面都是在不断的龟裂。
在其手掌上，有着血痕浮现出来，鲜血顺着指尖滴落下来。
赵烛面色阴沉的望着手中滴落的鲜血，一动也不动，似乎也是被这般结果所惊到，他显然没想到，他竟然会伤在一头他嘴中所谓的畜生手中……
百香楼内外，也是一片寂静。
那些剑来峰的弟子，浑身冰寒的望着这一幕，眼中同样是不可思议，他们剑来峰的圣子，竟然被一头只知道吃的小畜生给伤了？！
圣源峰两脉的弟子同样很震惊，在他们眼中那除了吃还是吃的吞吞，竟然如此恐怖？",1
元尊,第四百九十章 三关已过,"无数人都是屏息静气，大气都不敢出一声。
六响后，钟声微微凝滞。
那陆宏嘴角的冷笑陡然扩大，心中则是如释重负的松了一口气。
不过，就在他那一口气刚刚吐出来时，天地之间，又是一道嘹亮的钟吟声，自那主峰之内，悠悠传出……
七响！
哗！
整个天地，仿佛都是在这一刻，沸腾了。
铛！
当那第七道钟吟声响彻而起时，整个苍玄宗先是凝滞了瞬间，紧接着，便是有着滔天般的沸腾与哗然爆发而起。
无数弟子目瞪口呆的望着那座迷雾笼罩的主峰。
七响！
钟声七响！
那岂不是说，周元真正的通过了试炼三关？！圣源峰以往那么多弟子都无法办到的事情，终于是在今天，被周元做到了？！
这个家伙，竟然真的妖孽到了这种程度？！
在那残破古老的广场上，沈太渊，吕松两脉的弟子也是陷入了长久的凝滞，最后终于是清醒过来，紧接着便是有着震耳欲聋般的欢呼声响彻起来。",1
元尊,第四百九十三章 第二圣纹,"圣纹转动，眼前的青玉像似乎是有些变化起来，玉石渐渐的变得透明，周元的目光缓缓的移动，最后停留在了玉像伸出的手掌之上。
只见得那里，玉石深处，一道古老而神秘的光纹，静静的盘踞着，散发着苍莽之气。
望着那道古老神秘光纹的瞬间，周元的心脏便是剧烈的跳动起来，宛如响鼓之声，而那面庞上，也是有着激动之色，涌现而出。
第二道圣纹，果然在这里！
神秘的光纹，散发着一种让人心悸的伟力，静静的存在于青玉手掌的深处，那种熟悉的感觉，让得周元第一时间便是确定了这就是他苦苦寻找的那第二道圣纹……
周元胸膛起伏，片刻后方才渐渐的恢复，但那双目中的炽热，却是宛如火焰一般，怎么都难以熄灭下去。
毕竟为之向往许久的目标，终于是出现在眼前，那种心情，实在是难以自制。
周元脚步缓缓的上前，来到青玉像前，微微颤抖的伸出手掌，与那青玉手掌，轻轻的接触到一起。",1
元尊,第五百一十九章 迷天显威,"哗哗哗！
巨大的结界笼罩天地，而在这方结界内，顿时天地逆转，仿佛是变得宛如混沌，处于其中的人，皆是失去了时间，空间的概念。
啊！啊！
无数道惨叫声响起来，只见得那些剑来峰的弟子此时宛如断翅的鸟儿，铺天盖地的从天空坠落下来，噗通噗通的尽数落入了海水中。
他们在海水中挣扎，但不知道为何，不论他们如何想要腾空而去，最终都会落进海中，犹如是被什么神秘力量困住了一般。
甚至连孔圣、赵烛、百里澈三人，都是身形不断的坠落，不过他们实力强横，运转源气底蕴，所以落下的速度要慢许多，但看这般模样，迟早也会落入迷雾弥漫的海水中。
眼前一幕，诡异至极。
远处那些各峰的眼线，也是在此时目瞪口呆，显然是被震撼到了，毕竟眼前这一幕，实在有些壮观。
剑来峰近万的弟子，竟然全部被都陷了进去！
整个海面仿佛都是在此时沸腾。
“是结界！”
“好强悍的源纹结界！好大的手笔！”
“原来这就是周元和那周小夭的手段，他们根本就不是在逃跑，而是在引诱，他们早在此处布置好了结界，就等着剑来峰的自投罗网！”
“这是什么结界？竟然能够困住这么多剑来峰弟子？！这种结界，就算是灵纹峰的叶歌都不可能布置出来！”
“……”
各峰眼线都是在此时爆发出骇然的声音，他们原本以为圣源峰将会在下一刻被剑来峰摧枯拉朽般的摧毁，但谁能想到，眨眼之间，局面会变成这般模样！
不仅他们惊呆了，就连周泰这些原本准备跟剑来峰拼命的圣源峰弟子，都是一个个的张大着嘴巴望着眼前这一幕。",1
元尊,第五百二十六章 太玄圣灵,"百里澈也是冷哼一声，面庞有些阴翳，因为他从未想过，为了打败一个周元，他竟然要施展荡魔剑丸术。
“不过，也算是你的荣幸了。”
他冷笑一声，抬起头，望着那渐渐恢复的扭曲空间处。
然后下一瞬，他脸庞上冷笑便是渐渐的凝固。
哗！
与此同时，天地之间，忽有滔天般的惊骇声响起，那无数道目光，近乎呆滞般的望着那扭曲空间恢复处。
只见得那里，数千丈庞大的剑虹依旧保持着斩下的姿态。
但让人感到惊骇的是，在那剑虹之下，周元依旧是立于虚空之上，纹丝不动，并没有如众人所想直接被踢出了源池。
而在他的上方，有着一道约莫百丈的神秘光影浮现，光影将周元的身躯笼罩在其中，然后它双臂交叉，抵御在上方。
那剑虹之尖，便在此时，被挡在那神秘光影双臂之外，无法寸进丝毫！
荡魔剑丸术，竟然是在此时，被挡下来了！
无数弟子目瞪口呆。
那些原本士气大振，加快攻势的剑来峰弟子，也是面色惊愕的停了下来。
周泰，吕嫣，张衍等人同样是愣愣的望着那毫发无损立于虚空的周元。
莫说是他们，就算是在源池外，青阳掌教以及几位峰主，都是在此时惊咦出声，面容惊异，他们对视一眼，忍不住的道：“那道光影……”
“是太玄圣灵术！”
青阳掌教忍不住的有些动容。
“这个小家伙，竟然将太玄圣灵术给修成了？！”
而在不远处，沈太渊与吕松长老，也是嘴巴一点点的张大起来，双目之中，满是难以置信与震动。",1
元尊,第五百二十七章 拍碎剑丸,"整个天地，仿佛都是在此时凝滞了一瞬。
紧接着，便是有着滔天般的骇然声，此起彼伏的响彻而起。
“那是什么？！”
“这是什么源术，竟然将荡魔剑丸术都给挡下来！”
“怎么可能？！”
“……”
各峰弟子都是在此时彻底的失态，显然这一幕太过的震撼人心。
他们怎么都想不通，周元凭什么能够接下百里澈这一道连寻常九重天实力都能斩杀的恐怖杀招……
那是荡魔剑丸术啊！
苍玄七术之一，同时也是剑来峰品质最高的源术之一！
此术施展出来，本该是摧枯拉朽般的摧毁一切，方能匹配它的声名，然而眼下，却是被一道神秘光影挡于身前。
剑来峰与圣源峰的弟子，同样是张大着嘴的望着这一幕，不过双方的神情再度出现了变化，前者由欢喜渐渐的变为惊恐，而后者等人，则是从惊惧变为了茫然。
他们同样不明白为何周元能够硬接下这般杀招而毫发无损。
唯有周泰、吕嫣、张衍三人似是想起了什么，猛的对视一眼，眼中皆是有着难以置信浮现出来，然后有些艰难的喃喃道：“那道光影……难道是……”
“太玄圣灵术？！”
高空上，百里澈的牙齿间，有着低沉的声音一个个的蹦了出来，他脸庞扭曲，双目近乎通红般的望着那出现在周元周身的那道神秘光影。
身为剑来峰的首席，他的眼力自然比寻常弟子要高，所以当周元身躯外那道神秘光影一出现的时候，他便是将其认了出来。
当然，也唯有同为上品天源术的太玄圣灵术，才能够抵挡得住他的荡魔剑丸术。
“该死的小子！他怎么可能在这么短的时间中修成太玄圣灵术？！”百里澈咬牙切齿，眼中满是震怒。",1
元尊,第五百二十七章 拍碎剑丸,"“给我放开！”百里澈惊怒出声，急忙催动荡魔剑丸爆发出滔天剑气，试图将圣灵虚影撕裂。
不过圣灵虚影体内，不断的有着磅礴之力涌动出来，对着掌心镇压而去，将那滔滔剑气抹灭。
远处的周元，身形一动，出现在了圣灵虚影肩膀之上，他的目光平静的望着不远处面色铁青的百里澈。
“把剑丸给我放开！”百里澈怒喝道。
周元嘴角掀起一抹讥讽，脚掌一跺，天灵盖处有着金色源气冲天而起，最后落入了圣灵虚影体内。
“那般厉害的荡魔剑丸术，在你手中，却是修炼得如此虚浮不堪，说你辱了此术，还真是不假！”与此同时，他的声音，响彻而起。
得到了周元源气的支撑，圣灵虚影两只光掌都是猛然巨大化，最后似是发出嘶啸之声，双掌猛然狠狠的对拍在一起。
轰！
可怕的力量风暴肆虐开来，空间都是在此时剧烈的震荡。
咔嚓！
而那无数道视线，却是惊骇的盯着那圣灵虚影光掌对拍处，只见得那里，银色剑丸摇摇欲坠，竟是有着细密的裂纹浮现出来，最后更是在那一道道惊骇欲绝的目光中，爆炸开来……
他竟是直接将百里澈的剑丸给拍碎了！",1
元尊,第五百二十八章 分出胜负,"咔嚓！
当银色剑丸碎裂的那一刻，天地间那无数望着此地的各峰弟子，皆是忍不住的吸了一口凉气，面庞上满是难以形容的震撼。
谁能想到，周元如此凶悍，竟然直接是生生的将百里澈那荡魔剑丸一掌拍碎！
那究竟得多强的威能？！
“怎么会这样……”那些剑来峰的精锐弟子，也是呆滞下来，这是他们第一次见到荡魔剑丸会被人生生拍碎。
而周泰，吕嫣他们则是齐齐的咽了一口唾沫，望着高空上那道年轻身影的目光中，眼中竟是有着一丝敬畏之意流露出来。
此时的周元，气势太强了。
无数道视线转移，投向了百里澈的方向，而此时的后者，面色当荡魔剑丸碎裂的那一刻，便是变得苍白起来。
噗嗤！
最终他一口鲜血喷出，浑身的源气都是在此时紊乱起来，显然是受创不小，那荡魔剑丸乃是与他自身相连，如今剑丸碎裂，他自然也是受到了波及。
“周元！你敢碎我剑丸？！”鲜血在嘴角滑下，百里澈却是眼眶欲裂般的死盯着周元，发出震怒的咆哮声。
虽然他修成这荡魔剑丸依靠了外力，但终归是勉强修成，以后好好磨练，还是能够渐渐的让其凝实。
但眼下直接被周元拍碎，那他之前的苦修，显然也就化为了乌有，这如何能不让得百里澈暴怒。
高空上，周元目光居高临下的看下来，俯视般的盯着百里澈，眼神淡漠，当荡魔剑丸被碎的那一刻，这一场交锋就已经出现了结果。",1
元尊,第五百三十七章 破解真水,"一时间，这高空顿时混乱起来，其他圣子也是一阵头大，这下面的万丈水兽还没解决呢，结果上面就自己打起来了。
李卿婵也是感到心累，正要说话，忽然的怔了下来，有些难以置信的望着下方那万丈水兽。
“龙涎真水……破了？”
她的声音传开，顿时令得混乱的上空一静，众圣子惊愕的目光立即投射而去。
然后他们便是见到，此时那万丈水兽身躯表面的暗黄水衣忽然紊乱震动起来，然后那暗黄水衣便是溶解开来，顺着那庞大的身躯不断的滴落下去。
短短不过数息，那让得众圣子头疼万分的龙涎真水，便是在此时溶解得干干净净。
高空中，正面色铁青的赵烛望着这一幕，脸庞也是一点点的僵硬了下来。
那孔圣的眼中，同样是掠过一丝震惊之色。
龙涎真水，竟然真的被那周元给破解了？！",1
元尊,第五百三十七章 破解真水,"万丈水兽庞大身躯上，暗黄色的龙涎真水不断的溶解流淌而下，最后露出了其本身那透明如水晶般的身躯。
高空上，原本还处于内乱中的众圣子都是在此时停了下来，眼带着一丝震惊的望着这一幕。
龙涎真水，真的被破解了！
“这周元，竟然还真的做到了？”众圣子目光死死的望着海水中，他们显然有些无法想象周元究竟是怎么做到这一步的。
那龙涎真水的强悍，他们亲身体验过。
然而连他们都是束手无策的东西，却被周元如此轻易的化解了？
赵烛的面庞，也是在此时有些阴晴不定，有些火辣辣的感觉，先前他还在质疑周元，然而眼下的事实直接宛如一巴掌狠狠的甩到了他的脸上。
“怎么可能……”他忍不住的喃喃道。",1
元尊,第五百三十八章 喜提真水,"“嗯？”
而就在周元观看激战看得起劲时，他目光忽的一动，因为他见到周身的海水中，隐约有着一点点的暗黄光泽闪烁。
他心念一动，神魂之力散发，便是将附近那一点点暗黄光泽汇聚起来。
神魂之力形成的无形罩子中，一滴暗黄色的液体，静静的悬浮着，隐约间有着低沉的龙吟声传出。
“这是……”
周元望着那暗黄液体，微微沉默，半晌后，眼中有着摄人的精光暴射出来。
这熟悉的暗黄液体，赫然便是先前被他破解的龙涎真水！
显然，这是先前被溶解的龙涎真水落入了海水中，还未曾消散。
周元不由自主的舔了舔嘴唇，下一瞬，他的身影闪电般的暴射而出，神魂之力扩散开来。
海水之中，一点点暗黄光芒开始自四面八方飞来，最后汇聚在周元的掌心上。
短短不过数分钟，周元便是将附近的暗黄光点尽数的收拢，接着他便是眼神炽热的望着掌心上，只见得此时的那里，有着一团约莫人头大小暗黄水球悬浮着。
水球之中，散发着奇妙的波动，隐隐的仿佛能够看见龙影在其中窜动。
虽然这些龙涎真水比不上之前那万丈水兽身躯上的雄厚，但对于周元而言，却是足够了，毕竟他的身躯也没后者那么庞大。
“好宝贝……”周元眼神炽热，先前连众圣子都是无法打破龙涎真水，就足以说明此物强大的防御，虽然周元手中的龙涎真水肯定没办法和万丈水兽的比，但若是使用得当，定然也会成为极为厉害的护身之宝，而用在关键时刻，也能取到逆转乾坤之效。
周元取出一支玉瓶，以神魂之力将龙涎真水包裹，灌入其中，然后迅速的收起。
他心满意足的拍了拍手，没想到躲在这海水中，竟然都能有这般收获……",1
元尊,第五百三十九章 消灭万丈,"高空上，众圣子也是有些惊愕的望着这一幕。
“周元师弟真是一个好人。”楚青摸摸脑袋，感叹道。
商春秋也是点点头，道：“虽然周元师弟被淘汰了，但属于他的源髓，应该留给他。”
李卿婵红唇动了动，也是苦笑一声，还好有着护身印记，周元顶多只是被淘汰，可如果不是有这印记的话，周元这般鲁莽行径，必然将会付出极其惨重甚至生命的代价。
“先收起源髓吧。”李卿婵说道。
众圣子点点头，然后就打算动手将这最大的战利品收起，不过，就在他们身形刚动时，忽然有所察觉，目光猛的投向源池深处。
只见得那里，忽有一道流光升起，接着他们便是有些目瞪口呆的见到，一道有些灰头土脸的身影，从源池深处缓缓的升起，来到那万丈水兽源髓旁，一把将其抓在手中，最后破水而出，踩在了海面上。
“周元？！”
而望着那道踩在海面上，虽然有点狼狈，但脸庞上却是挂着灿烂笑容的人影，这天地之间，不论是众圣子还是远处那七峰弟子，皆是缓缓长大了嘴巴。
这个家伙，竟然硬抗下了万丈水兽那临死前的那一击？！
怎么可能？！",1
元尊,第五百四十章 源髓分配,"海天一色的天地间，无数道视线带着震惊的望着那踏着海水而立的年轻身影，此时的后者，虽然略显狼狈，但从其周身的源气波动来看，显然是并没有遭受太大的重创。
但这更让得无数人感到不可思议了，毕竟他们先前可是眼睁睁的看着周元吃下了那万丈水兽临死前的一击。
虽说此时的万丈水兽已是强弩之末，但那等攻击，依旧是极为的可怕，就算是换作其他圣子，单独相对的话，恐怕都得慎重。
所以，当周元毫发无损般的出现时，莫说是寻常弟子，就算是高空上的李卿婵等圣子，都是忍不住的睁大了眼睛。
“怎么可能？！”赵烛忍不住的出声道。
他倒不是想看见周元被淘汰，因为就算淘汰了，该他那一份源髓也是跑不掉，他是无法相信周元能够抗下万丈水兽的临死一击，那岂不是说，他们所有人都低估了周元的能力？
其他圣子面面相觑一眼，皆是无法解释。",1
元尊,第五百四十一章 源髓光柱,"周元望着这一幕，也是笑了笑，然后他的手掌一握，顿时宝石般璀璨的光芒爆发出来，那万丈水兽的源髓，在其手中出现。
嗡！
当那万丈水兽源髓出现的瞬间，顿时化为强烈的光芒冲天而起，汇入那停止攀升的光柱中，然后下一刻，那道源髓光柱便是在那一道道震撼的目光中猛然暴涨，一个瞬间，就已是将苍玄峰的那一道源髓光柱，超越而去。
十数息后，两道光柱皆是停滞下来。
而圣源峰的光柱，刚好超越苍玄峰百丈。
在那光柱之内，龙影盘旋，赫然是达到了七道之数！
圣源峰的弟子，皆是张大嘴巴望着这一幕，有些难以置信的样子。
而整个天地间，也是有些安静，各峰弟子望着圣源峰那攀升而起的光柱，也是有些失神，谁能想到，今年的源池祭，获得第一的，竟然会是这往年只能混一个低保的圣源峰？！
无数道目光望着立于圣源峰诸多弟子间，显得鹤立鸡群般的周元，眼神复杂而带着一些敬佩之意。
能够凭借个人之力，将那排名居末的圣源峰，生生的拉到这一步……这位圣源峰的新任首席，显然足以征服所有的质疑。
从今往后，在这苍玄宗，恐怕再不敢有任何人，对这位圣源峰首席，产生一丝一毫的轻视了……",1
