book,chapter,paragragh,tag
万相,第四百六十五章 两棍,轰！驮山金棍裹挟着惊人声势破空而至，然而李洛仰首望着那仿佛覆盖视野的惊天一棍，神色古井无波，只是手掌扶着刀柄，五指缓缓的紧握。体内的两股相力流淌，而后于体内交汇，融合。双相之力！只不过此次融合出来的双相之力，却仅仅只是“小融境”，并非是“合一境”，因为眼前孙大圣这一棍虽强，但却并未强到需要他动用合一境双相之力的地步。而在成功掌握了“合一境”的双相之力后，李洛已是能够自如的在两种境界中切换。双相之力流淌而出，直接是将金玉玄象刀所覆盖，而后李洛一步踏出，手中直刀直接猛然斩下。“千流水刀术！”嗡！那一瞬，仿佛是有着刀鸣声响彻而起，只见得一道十数丈左右的刀光伴随着李洛刀刃斩下，骤然暴射而出。那刀芒波光粼粼，犹如是万千水流在其中激流涌荡，释放着极其惊人的洞穿力。刀芒破空，发出了刺耳的尖啸之声。仅仅只是瞬息间，那一道刀光已是以极其惊人之速，与那呼啸而下的惊天金棍悍然相撞。铛！金铁之声陡然响彻而起。下一瞬，狂暴的相力冲击波于半空中肆虐开来，本就狼藉的四周遭受到了更为严重的摧残，大地上一道道沟壑被撕裂开来，四周的大树更是无一幸免。然而让得所有人都眼皮子一跳的是，当冲击波散去时，棍影与刀光竟然是尽数的消失。李洛的身影立于原地，手持古朴直刀，身影纹丝未动,1
万相,第四百七十六章 一刀,李洛认真的回答道：“先前人不多，就算打败了你们靠口耳相传恐怕震慑力也不够，所以我觉得等人多一点，效果会更好一些。”赵星影忍不住的怒笑出来：“李洛总队长的意思，是刚才在陪我们玩耍了？”“那倒不是，你也太妄自菲薄了，玩耍谈不上，但是可以说是热身。”李洛解释道。而后，他也不再理会三人眼中升腾而起的怒意，面色反而是渐渐变得愈发的平静，五指缓缓的紧握住玄象刀略显粗糙的刀柄。在他的体内，相力泡已经修炼到能够凝聚出十一颗的境界，距离最高层次也就仅有一颗之遥。只不过这十一颗相力泡中，有两颗是毒气泡，并不敢随意的动用。而其他的九颗相力泡，则是在此时瞬间破碎了七颗。滚滚相力自其中呼啸而出，同时李洛两座相宫内，同样是升腾起了雄浑相力。两道相力迅速的相撞，融合。双相之力！李洛目光如水，突然有一股极其强大的相力从其体内爆发，相力流转，渐渐的覆盖了手中的玄象刀，刀身之上，相力如水波般的流动，又带着昂扬的生机。金玉玄象刀在此时发出了细微的嗡鸣声。仿佛是一种淡淡的满足。而刀身在震动的时候，有一道蓝翠相间的相力光环，凝炼而出，环绕刀身。“合一境？！”这一道相力光环刚出现，赵星影三人便是猛然变色，显然也是有眼力劲的。“接得下这一刀，聚灵坛让给你们，又有何妨？”但李洛没有给他们过多震撼的时间，他言语平淡，紧握刀柄，而后一刀斩下。,1
万相,第五百零三章 李洛的破局,李洛手中玄象刀直接划起刀光削过。然后李洛手臂上大片黑色血肉被生生的剐了下来，甚至露出了白森森的骨头。李洛闷哼一声，立即催动体内相力化为治疗之力，顿时手臂上的血肉蠕动起来，开始渐渐的恢复。“你疯了？”李洛这自残的一幕落到幻阵中鹿鸣的眼中，顿时忍不住惊愕出声。然而，她此次的声音刚刚落下，她就感觉到了体内突然传来了剧烈的刺痛感，甚至连体内的相力，都是在此时开始紊乱起来。“怎么回事？”鹿鸣大惊失色，她急忙抬起手，只见得掌心中，竟是有着一抹黑色的毒斑在渐渐的扩散。那毒气异常的霸道，所过之处，连她自身的相力都是在纷纷溃散。“中毒了？！”鹿鸣心头有无尽寒意升起来。但是让得她惊骇的是，她究竟是什么时候中的毒？！,1
万相,第五百四十九章 身份,李洛同样是看见了黑甲人的暴退。他眼神微凝，突然间，暴喝出声：“黄楼统领，你的身份，你镇子上的兄弟还有老娘可知道？”李洛喝声如雷，而当他的声音落下的瞬间，那黑甲人面甲下的瞳孔骤然紧缩。一股惊怒之意由他心中升起。这个李洛，怎会知道他的身份？！这一瞬，黑甲人心神出现了瞬间的紊乱与震惊。而李洛眼中寒光一闪，抓住了他的破绽，拉动着弓弦，已经不断滴血的手指猛然松开。轰！霎那间，有狂暴的雷霆轰鸣，一抹雷光于这片区域之内绽放开来。雷光之中，仿佛是一条张牙舞爪的雷龙，怒发须张，龙鳞闪耀。雷光以一种无法形容的速度洞穿了空间，仅仅只是数息之间，便是趁那黑甲人的失神间，宛如天雷之势，重重的轰击在了其身躯外的那一层厚重黑甲之上。轰隆！恐怖至极的雷霆能量，在此时肆虐了开来。,1
万相,第五百六十九章 斩杀,随着这团诡异的眼球血肉暴露出来，只见得一旁手持着杆子的老妪身躯顿时融化开来，迅速的化为一滩黑色的液体。显然，这团眼球血肉，才是“惑心异类”真正的本体。看得出来，这“惑心异类”的本体并不具备着强大的力量，一旦真正的暴露，它的实力，或许也就相当于普通的赤蚀级异类。所以当暴露之后，“惑心异类”只能对李洛投去怨毒至极的目光，然后它竟是从杆子上面跳了下来，化为一道血光，自大街上穿梭而过，竟是打算逃窜了。“想走？”李洛冷笑，反手掏出了“光隼弓”，弓弦拉满，下一瞬，一道光流带着尖锐的破风声撕裂了长街上的空气，一闪之下，便是将那团血肉死死的钉在了地板上。叽叽！“惑心异类”爆发出凄厉的叫声，疯狂的挣扎。然后李洛却是不为所动，继续拉弓，一支支流光箭矢不断的暴射而出，将那“惑心异类”插成了刺猬，而伴随着一支支光矢的射来，这只“惑心异类”终于是承受不住，最终噗的一声，爆碎开来，化为满地腥臭的黑色浆液。就当“惑心异类”爆碎的那一瞬，这大街上那些原本凶神恶煞冲来的污染者顿时犹如凝滞了一般，就这样凝固在街道上，动也不动，如同一座座人形雕像，看上去颇为诡异,1
万相,第五百八十八章 一刀,“难怪此前那宫神钧对此刀垂涎万分，原来在这柄刀的深处，还隐藏着一位王级强者所留的印记。”李洛深吸一口气，眼神炽热，此前的他无法发现这道王者印记，想来应该是自身实力不够，按照他的推测，这道印记，唯有达到天相境的实力，才能够将其触发。有这道印记在身，金玉玄象刀的威能将会提升一个很大的档次。而眼下，它也将会是一道大杀器。李洛五指缓缓紧握刀柄，然后森冷的目光投向了赤甲将。他只有一刀的机会。不过有了金玉玄象刀内的“王者印记”相助，一刀足矣。一念至此，李洛不再犹豫，他一步踏出，顿时滔天般的血红能量呼啸而来，直接灌注进入手中玄象刀内，刀身剧烈震动起来，有嘹亮刺耳的刀鸣声响彻而起，只见得一道道百丈刀芒自刀身中迸射而出，刀光卷动，连虚空都被切割开了一道道幽黑深邃的痕迹。他面无表情，径直一刀斩出。血红刀芒于刀刃之前急速凝聚，短短数息之后，只见得一道数百丈庞大的刀轮成形，刀轮疯狂的旋转，散发着难以形容的切割力，刀轮震动，那刺耳的刀鸣声，响彻百里之地。,1
万相,第633章 黑龙冥水旗,郗婵导师秀眉微蹙，道：“李洛，这几部封侯术，以我的眼光来看，最适合你的，应该是之前那部“芥子木界”，你自身拥有木相与水相，而水相也能与木相形成相扶相持之感，若是修行此术，那掌心万木之界将会格外茂盛，充斥生机，一旦修成，威力不俗。”看得出来，郗婵导师是真苦口婆心，不想让李洛做出错误的选择，耽搁他修行的时间以及此次极为难得的机会。李洛无奈的叹了一口气，道：“导师，这是你逼我的，接下来你所看见的，希望你先帮我保密，毕竟我不想我的光芒太过的耀眼，以至于让学府有史以来所有的学员都黯淡无光。”这狂得简直要上天的话听得郗婵导师银牙都是轻轻的咬了咬，而后她双臂抱胸，眸光清冷的注视着李洛，倒是想要看看这家伙究竟在搞什么名堂。李洛则是心念一动，下一刻，一道相力自他的体内缓缓的升起，那道相力散发着特殊的威压，而后相力在他的身躯外凝聚，渐渐的化为了一道虚幻的龙影。吼！低沉的龙吟声，似是响起。然后郗婵导师那清冷如秋水般的眼眸便是在此时一点点瞪圆。这一刻，饶是以郗婵导师这见过大风大浪的阅历，都是震惊了。“龙，龙相？！”她震惊的失声。“你怎么会拥有龙相的？！”她疾声问道。,1
万相,第八百零九章 四十层,而后，两头煞魔首领如狼入羊群，直接展开了杀戮。可奇怪的是，随着它们的攻击扫过，那些盘坐在地的八千旗众，竟是渐渐的变得虚化了起来。这一幕，让得两头煞魔首领愣了愣。“蠢货，只是幻影而已。”高空上，传来了李洛冷笑的声音，原来青冥旗旗众的位置，早已被他以水相之力所形成的折射幻影所隐藏，这两头煞魔首领找到的，只是幻象而已。吼！伴随着李洛声音的落下，有龙吟声随之响起，只见得虚空破碎，一条黑龙驾御着漆黑的黑水破空而出，然后将两头煞魔首领淹没。待得黑水消散时，这两头实力堪比虚侯境的煞魔首领，便是直接被消融而去。短短片刻间的交锋，五头煞魔首领，三头受创，两头减员。李洛见到这一幕，内心松了一口气，但手下力度却是丝毫不减，直接是驱使着磅礴的能量，酝酿出一波波的攻势，开始对着剩下的三头煞魔首领席卷而去。而在李洛的攻势下，三头煞魔首领也是渐渐的显露出劣势，最终，当李洛以最后的力量施展出天龙雷息以及黑龙冥水旗的攻势时，三头煞魔首领，彻彻底底的被击溃了。,1
万相,第八百五十三章 越级突破,待得第二日晨辉撕破云层倾洒而下时，修炼室中的李洛缓缓睁开了双目，他的眼中有刺眼的金光流动，而后又是渐渐的收敛下去。一股强悍的能量波动如潮水般自他的体内扩散出来，那股澎湃之感，令得李洛内心激荡不已。他感应着体内，此时三座相宫皆是在绽放着光彩，一股隐隐的鼓胀感，自其中散发出来。这是因为三座相宫，已经抵达了容纳的极限。此时这三座相宫内，拥有着足足三万五千道地煞玄光！这是极为惊人的成就。按照常理来说，就算是拥有着九品相的天骄，在这大煞宫境巅峰时，所能够修出的地煞玄光，恐怕也不会超过两万道。但李洛，却是凭借着三座相宫的优势，生生的搞出了三万五千道。对此，李洛不敢说自己是前无古人，后无来者，但在他的认知中，应该是没人比他更强吧？,1
万相,第九百零一章 墨玉树龙,这并非结束，李洛那如琉璃般的身躯表面，有玄妙的光纹在此时绽放出光彩，那光纹之中似乎是散发出极其炽热，滚烫的能量，在这股能量的加持下，李洛身躯宛如是一座熔炉，肉身在此时仿佛被增强到了一种极为惊人的强度。此时的李洛，仿佛一尊琉璃神像，他一步踏出，身影直接是出现在了三柄灵刀之前，然后五指紧握成拳，直接在那众多震惊目光中，一拳轰出。轰！滚滚气浪排山倒海一般的倾泻开来，引得四方云动，音爆之声，更是在整座山头回荡不休。拳光呼啸，直接与三柄灵刀相撞。撞击，仅仅持续了一瞬，然后在场数万旗众便是心头一震的听见到了一种破碎之声。只见那半空中，三柄灵刀之上的裂纹急速的扩大，最后轰然一声，爆碎成了漫天锋利的金色光点。只不过这些光点冲击到李洛那如琉璃般的身躯上时，却是仅仅留下了诸多白点。这一幕，直接是引得原本喧嚣不断的广场四周，陷入了一片死寂之中。,1
万相,第九百四十二章领头人,李武元双目虚眯了一下，眼神如锋利刀刃般的盯着李洛面庞看了数息，淡笑道：“李洛师弟，就这么没规矩吗？二十旗从规格来说，也算是天龙五卫的下级。”李洛想了想，从空间球掏出了一枚青冥院大院主的令牌，同时露出温和的笑容，道：“不好意思，我同时还兼任青冥院大院主，虽然是暂代，但是如果你要说身份规格，那么就请你不要叫我师弟了，直接叫我大院主吧。”场中气氛顿时一滞，众人面色奇特的望着李洛手中那代表着青冥院大院主身份的令牌，在各脉之中，各院大院主位高权重，与这等身份相比起来，莫说是李武元，就算是天龙五卫中的各大统领，都不敢对李洛摆身份。只是...这李洛才只是极煞境的实力，那李惊蛰脉首怎么就将青冥院大院主的令牌都给了他？而且还让他暂代青冥院大院主之位？这是...何等的儿戏？但是李惊蛰才是龙牙脉的脉首，他的决议，就算是龙血脉的李天玑脉首也无法责其更改。所以，望着李洛手中的令牌，所有人都只能默默的吞了一口口水。“本来是要以普通的身份和你们相处，可是你却硬要给我讲身份规格，这样一来，你让我怎么好融入大家？”李洛有些不满的感叹道。李武元脸庞上的神情略微有些僵硬，他是万万没想到，李洛竟然还能有这么一重正式的身份，这龙牙脉行事都是如此的随心所欲吗？那位李惊蛰脉首，未免也太宠溺李洛了。,1
万相,第九百八十三章 一箭灭魔,他们的视线透过火焰，能够看见李洛那全身烧焦的皮肤，当即皆是明白，李洛在催动这恐怖的一箭时，自身也是在遭受反噬。李洛眼神没有波澜，他注视着远处半空中的“蚀灵真魔”，那焦黑的手指毫不犹豫的松开了弓弦。恐怖的力量在此时被释放，李洛双指血肉瞬间崩碎，露出了森森白骨。但随着弓弦的松开，那被束缚的“金色火焰箭矢”则是在这一瞬轰爆了虚空，一层层云爆于其后方成形，金色的火光犹如金乌划过天际，金光倾洒而下时，将那弥漫的魔雾迅速的焚烧，化为虚无。金色火焰箭矢速度极快，在场众人即便是强如秦鹰等人，都仅仅只能见到一道金光掠过天际。待得再度回神时，那弥漫着熊熊金色火焰，仿佛张牙舞爪的金色火龙般的箭矢，已经狠狠的射在了那流淌着鲜血的人皮面孔之上。熊！那一瞬间，金色火焰席卷，整片天际仿佛都被点燃。人皮面孔发出凄厉的惨叫声，直接以惊人的速度被焚烧殆尽，而后金色火焰箭矢将其洞穿，射向了位于后方的“蚀灵真魔”。蚀灵真魔尖啸不断的响起，那巨掌拍出，化为无数道黑影，似乎想将火焰箭矢阻拦。砰！但那流淌着金色火焰的箭矢却是以势如破竹之势，轻易的撕碎了蚀灵真魔所有的防御，最终在那诸多震惊的目光中，射进了蚀灵真魔本体之中。,1
万相,第九百八十六章 江晚渔,试试你的水准！”江晚渔性格仿佛如其相性一般，风风火火，她话音刚落，身影便是对着李洛暴射而去，手中玉尺挥动，对着面前虚空陡然划下。虚空在此时陡然出现了一道裂痕，下一刻，似是有震耳欲聋的龙吟声响彻而起，只见得一条燃烧着熊熊烈焰的火龙，猛的自虚空中冲撞而出，裹挟着滔天烈焰，以一种无比霸道的姿态，对着李洛呼啸而去。李洛见到江晚渔所施展出来的这道封侯术，却是忍不住的发呆了一息，因为此术对于他而言，属实是太过的熟悉了。旋即李洛清醒过来，嘴角有着一抹笑意浮现。他单手结印，体内相力喷薄而出，同时一刀斩下。虚空裂开缝隙，只见得海水奔涌的声音响起，一条黑龙驾驭着森寒冥水，也是撞破虚空而现，最后直接与那赤红火龙相撞。轰！两者撞击在一起，顿时弥漫着漫天的高温水雾，两股属性不同的力量彼此侵蚀，消融。如此好半晌后，余波方才渐渐的消退。李洛收刀而立，他看向那江晚渔，此时后者那冷傲的俏脸却是充满了震惊之色，她难以置信的望着李洛，失声道：“黑龙冥水旗？！你怎么会我天元古学府的封侯术！”,1
万相,第九百九十一章 百兽魔神体,哈哈，李洛，你果真只是从外神州那等偏隅之地回来的乡巴佬，一道通灵级封侯术，却被你视为倚仗。”赵神将狞笑出声，他那青色龙拳陡然紧握，然后就这样平淡的一拳轰出。吼！然而这看似简单的一拳，却仿佛是将前方的虚空都是生生的炸碎，只见得空间仿佛是在此时呈现崩塌般的迹象，一股恐怖的力量直接轰在了那驾驭着冥水的黑龙身躯上。砰！黑龙庞大的身躯瞬间破碎开来，化为漫天光点。正如江晚渔所料，通灵级别的黑龙冥水旗，对于现在的赵神将，毫无威胁。然而李洛的神色却是颇为的平淡，其嘴角在此时微微勾起一抹诡异的弧度，同时单手结出了一道印法。当其印法形成的那一瞬，躯体破碎大半的黑龙突然张开了龙嘴，一道黑色龙息对着赵神将喷了过去。赵神将冷笑，刚欲懒得理会这种攻势，但他的身体却是在此时爆发出了剧烈的刺痛，那是一种近乎面临死亡般的预警。赵神将背心瞬间被冷汗所充斥，他眼瞳中倒映着那喷来的黑色龙息，在这个时候，他终于是感应到，眼前那看似普通的黑色龙息深处，仿佛是蕴藏着一道极为恐怖的波动。那道波动，连他的“百兽魔神体”，都是难以承受。李洛这个贱人，竟然以一道通灵级封侯术麻痹他，然后将真正的杀招，藏于其中！,1
万相,第一千零三十章 一刀枭首,“腌东西，不要顶着灵净堂姐的模样！”他低吼一声，刀光猛然斩下，而在斩下的那一瞬，他心念一动，体内那众相龙牙剑阵中，水，木龙牙剑皆是爆发出剑吟声，两道霸道到极致的剑气倾泻而出，融入刀光之中。而后刀光落下，与九指骨掌相撞。嗤！碰撞瞬间，没有任何惊天之声，唯有刀光悄然划过的声音，刀光掠过，如炽热刀锋划过热油。李洛的身影如鬼魅般的出现在了“李灵净”身后，他眼中杀意渐渐的消退。直刀缓缓入鞘。而身后的“李灵净”，九指骨掌在此时陡然破裂，而其脖颈处，似是出现了一道血线，血线处，有两股霸道剑气疯狂肆虐，短短数息，“李灵净”的身体便是砰然爆碎，化为满地蠕动血虫，继而化为血气纷纷消散。李洛深深的吐了一口气，身躯上流淌着的凶煞能量尽数褪去。斩杀这“李灵净”后，李洛方才转身，看向秦漪，然后发现后者此时正怔怔的瞧着他，似是也被他那干脆利落的惊艳一刀所惊。,1
万相,第一千零七十九章 一刀斩之,然而，那王焘的眼中，却是在此时有着一抹惊恐之色涌现出来，因为他发现，在两股力量碰撞的时候，他的剑光，几乎是在以一种难以想象的速度溃败，消融。“不可能！”王焘骇然失声。他堂堂七星天珠境，怎么可能在正面的对碰中，竟会被李洛摧枯拉朽的击溃？！然而，事实再残酷，那也是事实。黑龙咆哮，释放着恐怖之威，锋利的龙爪贯穿而下，连带着虚空，将那如猛虎般的剑光，尽数的撕碎。黑龙呼啸而来，裹挟着森寒之气，撞向了王焘。王焘只来得及爆发所有相力，于身前形成防护。轰！能量风暴肆虐席卷。王焘身前的相力防御几乎是顷刻间崩碎，黑龙贯穿而过，在那地面之上，留下了一道约莫千丈的深深痕迹。李洛站在原地，驻刀而立。他看了一眼前方那满脸残留着难以置信与惊骇之色，缓缓倒塌下去的王焘。砰！王焘倒下的声音，在这寂静的氛围中，分外的刺耳。,1
万相,第一千零八十四章败陈玄,而陈玄的欣喜，也是落入到了李洛敏锐的注视中，当即他脸庞上忍不住的浮现出一抹笑容。下一刻，他屈指一点。吼！黑龙咆哮，龙嘴陡然张开，只见得漆黑冰寒的龙息呼啸而下，直接对着那青色羽翅轰去。陈玄见状，也是立即反击，伴随着其印法变幻，青色羽翅之上飞出无数道凌厉锋锐的青光，与龙息相撞。轰！两者撞击的瞬间，龙息被轻易的撕裂开来。可就是在龙息被撕裂的那一瞬，陈玄还来不及松口气，他浑身汗毛便是在这一刻陡然间倒竖起来。因为他感觉到了一股极为可怕的波动自那龙息中涌现。陈玄目光急忙投射而去，便是见到在那龙息深处，一柄湛蓝色，略带着弯曲弧度的龙牙剑静静悬浮，下一瞬，龙牙剑伴随着龙息余波落了下来。嗡！天地间，似是有龙吟与剑啸声，融合在了一起。那柄龙牙剑的速度太快了，陈玄心头有无尽寒气升起，他催动巨大的青色羽翅迎上，同时他脚下似是踩着狂风，以一种惊人的速度暴退。咻！一抹湛蓝的剑光，划过天际。青色羽翅在接触的瞬间，直接被一分为二，甚至连下方的群山间，都是出现了一道深不见底的剑痕。轰！剑光划过，那暴退的陈玄瞬间被追上，此时的他，亡魂皆冒，他难以想象，那道剑光为何会凌厉到这种程度。此时，他的瞳孔中倒映着那仿佛能够无视空间距离的剑光，他心头涌上了浓浓的惊骇之意。,1
万相,第一千零八十八章 化龙！三龙牙！,而在莫云心中祈祷的时候，李洛同样是见到了三人倾尽全力爆发的攻势，那等威势，的确是不容小觑。不过李洛也并没有过多的理会，他的心神尽数的投注到了头顶的剑阵之中。两柄龙牙剑已现，但李洛却并未就此停止。呼。他深吸一口气，体内雄浑相力源源不断的流失，而与此同时，在那剑阵内，突然有一点亮光涌现。那亮光极为的明亮夺目，犹如是太阳之火，散发着神圣之意。一缕缕圣洁的力量在凝聚，隐隐的，形成了一道极为模糊与虚幻的龙牙剑。这一柄龙牙剑，其上流转着无尽的光明，耀眼璀璨。剑光若隐若无的流转，仿佛是圣洁火焰所化。这是李洛所凝炼的第三柄龙牙剑。光明龙牙剑！以光明相和龙相之力凝炼所成。只不过这柄光明龙牙剑明显还不算是完全凝成，毕竟李洛的光明相只是辅相，论起相力强度自然是远不及水相，木相这两道主相。但即便只是半成品，眼下在“众相龙牙剑阵”的加持下，依旧能够将其威能推动到一个恐怖的程度。李洛双手合拢，印法变幻。嗡！三道滔天剑光，陡然自三柄龙牙剑体内爆发而出，最后随着众相龙牙剑阵的推动，三道剑光凝结在了一起。只见一片磅礴的星河剑光于剑阵内流淌，那剑光内仿佛是有着无数的晶尘，剑光流动时，仿佛是一条古老的巨龙在无垠的宇宙中游荡。一股无法形容的凌厉之威散发出来，虚空在此时不断的被割裂出破碎的痕迹。,1
万相,第一千零八十九章 我拒绝,“李洛，如今你已经将另外两座圣学府都淘汰了，而一等名额有两个，所以你没必要再出手了！”“那两个名额，完全可以由我们两方各取一个！”高虚瀚连忙说道。此时的他，再没了先前的气势，因为现在的他就是待宰的鱼，只是取决李洛何时下刀。虽说高虚瀚也看得出来李洛已经油尽灯枯，但他这里更惨，几乎动弹不得。李洛的脚步微微一顿，似是面露思索之色。现在的场中，只有他们两个学府的代表，从某种意义而言，他们的确不用再打了。高虚瀚见到李洛停下脚步，顿时大喜，继续道：“李洛，多个朋友多条路，没必要赶尽杀绝啊！”李洛笑了起来，而就在高虚瀚欣喜若狂的时候，他却再度拖着龙象刀走了过来，然后站在后者的身旁。“你的提议很有趣。”李洛冲着高虚瀚露出灿烂的笑容。“但是我突然记起来，你们学府的导师，前些天还威胁了我的导师，试图抢夺我们圣玄星学府的资格。”“所以很遗憾...”李洛缓缓的举起手中的龙象刀。“你的提议，我拒绝。”,1
