book,chapter,paragragh,tag
元尊,第二十六章 崛起之势,"“他的力量，怎么会如此可怕？！”林枫心头一震，眼中有着骇然之色浮现。
“给我破！”
周元的冷厉喝声，也是在此时，猛的响起。
嘭！
就在他声落下的那一瞬间，所有人都是骇然的见到，林枫身体表面那层黑色光膜，竟是应声而碎。
“我认……”林枫脸庞上更是惊骇欲绝，急忙出声。
不过，周元还不待他的声落，那蕴含着所有力量的一拳，便是重重的落在了林枫胸膛之上。
噗嗤！
一口鲜血喷出，林枫的身体直接是在那一道道震惊的目光中倒飞了出去，在那半空中越过数座演武台，最后方才重重的落地，在那地面上搽出长长的痕迹，当场昏死过去。
随着林枫落地，整个演武场都是一片的寂静，所有人都是目瞪口呆的望着这一幕，甚至连苏幼微都是玉手捂着红唇小嘴，美目瞪圆。
“怎么会这样……”
所有人都是喃喃自语，满脸的难以置信，他们先前还在惊叹于林枫那强悍的防御，然而下一刻，那无可摧毁的铁魔壁，就这样被周元一拳轰稀烂……
这得多强的力量？
这是开两脉的人能够做到的？",1
元尊,第六十三章 一招立威,"周元忽的深吸了一口气，源气滚滚涌入其体内，天元笔猛的一震，然后一缕缕青芒便是自天元笔笔尖冒了出来。
“玄芒术！”
不过这一次周元施展的玄芒术，那青芒，已达数寸，再加上天元笔的增幅，那威力，远非府试之时可比。
唰！
他身影射出，手中天元笔犹如长枪一般刺出，空气被撕裂，发出尖锐的声音，然后在那众多的目光注视下，直接与那精瘦男子斩下的火刀，重重的碰撞在了一起。
铛！
金铁之声响彻而起，火花溅射。
不过在声音响起的同一时间，所有人都见到，一道身影直接是狼狈的倒射而出，脚掌蹬蹬的连踩着地面，数十步后，方才狼狈的稳住。
哗！
而当他步伐稳住时，众人看去，顿时爆发出哗然之声，因为那人，赫然是那位开八脉的精瘦男子。
谁都没想到，实力达到开八脉的精瘦男子，竟然在周元的手中，连一招都走不过！
此时的后者，也是面露震惊，他缓缓的抬起手中的火红长刀，只见得长刀上，有着裂纹浮现出来，最后咔嚓咔嚓，直接是破碎开来……
周围那无数视线，都是涌上一抹震惊，这周元殿下，竟然直接将这柄中品源兵都给毁了？这得多强的力量？
篝火旁，卫青青也是美目微睁的望着这一幕，她能够清晰的感觉到，先前周元那一击，究竟是何等的凶悍。
那一击，恐怕就算是养气境初期的高手，都将会感到威胁。
“原来，传闻竟然是真的。”卫青青喃喃道，美目带着一丝惊奇的盯着周元的身影。
台上，周元手中天元笔斜指地面，淡笑道：“承让了。”",1
元尊,第七十章 到手,"卫沧澜挥了挥手，有着侍女端着一个玉盒而来，然后他接过，亲自递给周元，道：“这里面就是那‘吞源石’。”
周元闻言，心中也是掠过一抹激动，小心翼翼的接过玉盒，将其打开，只见得其中躺着一颗约莫巴掌大小的灰黄色石头，石头上下有两孔，一大一小，小孔散发着吸力，将天地间的源气吸取而进，然后那大孔处，则是有着源气喷薄而出，可以感觉得出来，大孔喷出的源气，无疑是要更为的精纯。
果然是吞源石！
周元眼中浮现出喜色，将玉盒收入了乾坤囊，这吞源石，总算是到手了，接下来只要再搞到那四品蟒属源兽魂，他修炼祖龙经第一重的材料就准备齐全了。
这番忙活，不亏。",1
元尊,第八十七章 斩杀,"山谷外，那些看向深谷的目光，都是在这一刻沉默了下来，半晌后，便是有着滔天般的哗然声爆发起来。
“齐昊死了？！”
“怎么可能？！先前他还稳稳的占据上风，怎么突然间就落败了？！”
“发生了什么？”
“……”
所有人都是目瞪口呆，一副见鬼的模样，一分钟前他们还在怜悯周元，觉得他定会死在齐昊的手中，但一分钟后，结果就逆转了。
“先前好像隐约看见什么从齐昊体内钻了出来。”不过还是有着眼力毒辣的人，隐约的发现了点什么。
“应该是周元的手段，那齐昊不知不觉就中招了。”
这些人面面相觑，最终惊叹出声，不管周元使用的是什么手段，但最终获胜的是他。
“真是难以置信，他竟然以养气境初期的实力，斩杀了养气境后期的齐昊！”
“而且最关键的是，他还未曾修炼功法源气！”
“真是个……怪物啊！”
“大周王朝，竟然会有一个如此变态的殿下……看来日后，要多多小心一些才是。”",1
元尊,第一百零六章 力斩太初,"而在那下方，一道道城墙上，无数道目光都是目瞪口呆的望着这一幕，谁都没想到，先前还在施展杀招的王朝天，在顷刻间后，便是这般凄惨的死在了周元的手中。
“殿下！殿下！”
在经过短暂的寂静后，城墙上，忽的爆发出惊天动地般的欢呼声，大周那些将士，士气也是在此时暴涨到了顶点。
而反观那大齐方向的军队，则是开始有些混乱起来。
那双方正在交战的太初境强者更是震撼，眼中满是骇然之意，他们怎么都没想到，最先结束战斗的，竟然是他们刚开始最觉得不可能的两座城门……
至此，大齐一方，两名太初境强者，陨落。",1
元尊,第九十三章 银影,"于是，周元的身体之外，很快就被先前的银色战甲所笼罩。
银色战甲紧闭的双瞳忽然睁开，眼中银光流转，不过却是有着惊呼声，从其嘴中传出：“好神奇的战傀！”
那声音，虽然有点变化，但显然是来自周元。
“我感觉此时的力量非常的恐怖。”周元惊喜万分，银色战甲紧紧的包裹着他的身躯，而他则是能够如同指挥自己的身体一样操控着战傀。
两者宛如是真正的融合在了一起，完美契合。
而且，最令得周元震惊的是，他感觉此时的他，似乎非常的强悍。
这座银色战甲，赋予了他极为惊人的力量。
感受着那种汹涌的力量，周元忍不住的想要尝试一下，于是，他忽的紧握手掌，银色战甲那锋利的手掌也是立即握拢。
周元单膝跪地，猛的一拳对着地面轰下。
轰！
这一拳下来，整个地宫都是在疯狂的颤抖，再然后，周元便是震撼的见到，眼前大地直接被他一拳轰出了一道裂纹，甚至地面，都是出现了龟裂。
“好强，这一拳的力量，甚至媲美太初境！”周元狂喜的惊呼道。",1
元尊,第一百二十五章 水晶球,"不过，虽说遭受重创，但古翎却是森然一笑，看向周元所在的方向，道：“小子你还是太嫩了，中了我这破神针，你必死无疑！”
周元身外的尘烟，渐渐的散去，而当其现出身时，古翎脸庞上的笑容，则是一点点的凝固了下来。
只见得此时，在周元的眉心处，有着青色的鳞片浮现出来，而那枚细微的黑色长针，则是插在鳞片上，无法深入。
周元伸出手掌，将眉心间黑针取了下来，眼神淡漠的望着古翎。
“怎么可能？！”古翎惊恐失声，先前他的出手，迅如奔雷，时机也是掌握得完美，但怎么依旧还是被周元给挡了下来。
“你还真是一个骨子里面散发着阴毒的家伙。”周元淡淡的道。
古翎面色惨白，他望着携带着杀意一步步对着他走来的周元，急忙狼狈后退，道：“你敢杀我，我们古家定然不会放过你！”
周元嘴角的笑容有些讥讽，都到这个时候了，他们和古家可没半点余地可走了。
那古翎似也是明白，猛的爬起，手掌一拍地面，身形便是暴射而退，想要借机逃离。
然而周元怎么会让他有这种机会，指尖那枚黑针猛的一弹，便是化为一抹毫光，闪电般的追上了古翎，最后自他后脑勺，洞穿而过。
古翎脸庞上的神情凝固下来，身躯重重摔落在地上，眼中生机消散，直到此刻，他方才有些后悔，为何要在那珍宝阁中招惹这对男女……
而且，他眼中这个养气境的杂鱼，似乎比他想的，强太多了。",1
元尊,第一百五十章 大风雷,"风雷兽庞大的身躯无力的坠落下来，震得地面都在抖动，湖面上泛起涟漪。
周元收起天元笔，眼神炽热起来。
因为伴随着风雷兽生机的散去，只见得其身体上开始有着一缕缕白雾升起来。
那每一缕白雾，都是蕴含着极为精纯的源气。
“不愧是四品源兽，远比之前遇见的那些雄浑。”周元赞叹道，之前猎杀的源兽，都只有一缕，然而这风雷兽，却是数十倍之多。
白雾不断的升腾，最后开始凝聚，滴溜溜间，竟是形成了一道约莫人头大小的白色气团，气团渐渐的缩小，最后竟是化为了一枚拇指大小的白色珠子。
珠子宛如盛装着云海，漂亮至极，然而那自其中散发出来的雄浑源气，却是让得周元垂涎三尺。
周元抹了抹嘴，他能够感觉到，如果他吸收了这枚白色源珠，很有可能就会彻底的填满自身气府。
到时候，他就能够跨出那一步，真正的踏入天关境！",1
元尊,第一百五十章 大风雷,"而在周元收走白色源珠后，他再度眼热的见到，一缕白雾再度从风雷兽的身上袅袅升起，最后化为了一道青黑色的玉简。
周元闪电般的伸出手，一把就将其抓在了手中，眼神滚烫。
玉简一入手，便是有着信息涌入周元脑海。
周元闭目感应，片刻后睁开双目，眼中有着狂喜的光芒涌现，正如他所料，这道玉简之中，记载着一道小小天源术。
这道小天源术，名为大风雷。
修炼之法尚未读取，因为这些玉简都是一次性的，一旦接受，玉简也会碎裂，无法再给第二人修炼。
“总算是得到了。”
周元心满意足的收起玉简，事到如今，他也算是得到了一卷小天源术，若是修炼成功的话，对于他自身的实力提升，无疑是极为的巨大。
“这一次收获倒是不小。”
周元忍不住的一笑，不仅得到了一枚白色源珠，能够助自身突破到天关境，更是得到了一卷小天源术。",1
元尊,第一百五十六章 蟒吞魔轮,"“怎么可能？！”
无数道惊骇的声音几乎是同时间的响了起来，那一双双眼珠子，更是凸了出来。
他们怎么都没想到，竟然会是这种结果……
萧天玄那道威力恐怖的小天源术，竟然连个水泡都没冒出来，就没了声息。
这个周元，竟然是怎么办到的？！
萧天玄脸庞上的神情，也是在此时一点点的凝固。后方那古灵，更是一副见鬼般的模样，嘴中都能塞进一个鸭蛋。
“你这小天源术，似乎还没真正修成吧……威力弱了点。”周元望着萧天玄那凝固的表情，淡笑一声。",1
元尊,第一百七十四章 金池,"巨山山顶，是一座火山口，而如今这火山口中，金液充斥，犹如一汪金池，金光绽放，隐隐间有着异香传出。
周元、绿萝、甄虚三人，都是眼神炽热的望着眼前这汪金池，他们能够感受到，体内的源气，仿佛都是在此时变得活跃起来。
“这就是金池吗？”三人都是垂涎的望着金池，心跳加快。
噗通。
吞吞则是率先跳了进去，游荡在水面上，兽瞳微闭，犹如是无比的享受。
而周元他们也是能够看见，金色的池水波荡着，似是有着一缕缕金光，在源源不断的涌入吞吞的体内。
“机缘已在眼前，能得几分，就靠各自了。”周元冲着绿萝、甄虚一笑，也是跳了进去。
绿萝抱着小寒，大眼睛放光，毫不犹豫的跃进去，然后与小寒在池水中欢呼着。
甄虚心情激荡，也是迅速跟上。",1
元尊,第一百九十七章 双龙斗,"“这个变态……”绿萝喃喃道。
“竟然能够做到这一步……”甄虚低声道。
左丘青鱼美目明亮，嫣然一笑，狡黠的道：“看起来……这家伙似乎也是个很不错的选择呢……”
宁战面目凝重，盯着周元的身影：“这个家伙，好厉害，好想和他……打一场！”
剑瞎子李纯均轻握着重剑，沉默了一下，道：“周元，看来以后，你会是一个比武煌更适合我磨剑的人……”
叶冥也是咳出一团血丝，摇头笑道：“呵呵，武煌啊武煌，真是没想到，你最后，竟然会栽在他的手中……”
此时此刻。
整个天地的目光，都是汇聚向那白玉广场。
那般画面，分外的震撼人心。
残阳之下。
一人单膝而跪，一人头颅脱落，鲜血冲天……",1
元尊,第二百零三章 四道圣纹,"那滴金色鲜血一出现，便是在天地间引来了风暴呼啸，无数源气席卷而来。
“这是什么？”周元死死的盯着那滴金色鲜血，咽了一口口水。
苍玄老祖淡笑一声。
“这就是你们前往圣迹之地梦寐以求的东西……老祖我的一滴圣血。”
“圣血……”
周元眼神滚烫无比的望着那一滴金色的鲜血，他能够感觉到其中蕴含的磅礴源气，那种精纯程度，让得他头皮都是微微发麻。
他如何不知，苍茫大陆上所有骄子云集于此，所为的，不就是这一滴传闻之中的圣者之血吗？",1
元尊,第二百一十八章 一拳足矣,"满山寂静。
一道道震骇的目光，望着那半空中，保持着一拳轰出姿势的周元。
周元眼无波动的望着那被他一拳从山腰轰到山脚的韩山，方才将先前未曾说完的话，彻底的落下：“现在……一拳足矣。”
寂静的源山上，那坐在山顶修炼台上的陆风，微闭的眼睛微颤，终于是睁了开来。
顾红衣的俏脸上，也是流露出了一丝惊讶。
其他人，更是瞪大了眼睛，谁都没想到，太初境二重天的韩山，竟然在周元的手中，连一拳都没撑过去……
他们原本以为，起码会有一场还算激烈的交手。
但却未曾想，战斗，还没开始，就已经结束了……",1
元尊,第二百三十四章 打翻一群,"“你们愣着干什么！一起上，打他啊！”
半空中，被打得头晕眼花的祝峰失态的咆哮道。
那些弟子面面相觑一眼，最终也是顾不得以多欺少了，当即硬着头皮暴射而出，对着周元围剿而去。
“先前就说了让你们都上，偏要墨迹。”周元瞧得众人攻来，淡笑一声，周身雾气更浓，速度竟是再度暴涨。
唰！
他直接是犹如一道鬼魅般的影子，冲进了那十来道弟子之中。
砰！砰！
战圈内，一片混乱，那些弟子虽然实力也不错，但却连周元的衣角都摸不到，而反观周元，身影掠过时，那布满着紫金鳞片的拳头，便是携带着雄浑的源气，毫不客气的一拳拳轰到众人身体上。
拳拳到肉，凶悍异常。
于是，短短不过数分钟，那地面上便是躺满了身影，个个鼻青脸肿，嘴角挂着血迹，满地的呻吟。
而在中间，周元垂手而立，虚化的身躯渐渐的恢复。
他的神色淡漠，没有任何的波澜起伏。",1
元尊,第二百五十六章 麻烦上门,"一股惊人的波动，自那源纹中散发出来。
那赫然是一道，四品源纹！
“源纹？！他什么时候刻画出来的！”秦镇瞳孔猛然一缩。
在那无数道惊恐的目光中，周元面无表情的伸出手指，轻轻的打了一个响指，清脆的声音响起。
“玄山封镇纹！”
轰！
源纹陡然爆发开来，天地间的源气疯狂的席卷而来，短短数息，只见得那源纹竟然便是化为了一座百丈左右的源气大山。
源气大山直接是对着秦镇镇压了下去。
啊！
秦镇面露骇色，急忙源气运转，双臂伸出，将那源气大山扛住。
噗嗤！
不过刚刚接触，他便是一口鲜血喷了出来，因为那座源气巨山，沉重得无法形容，直接是将他的身体压得嘎吱作响，剧痛自双臂处蔓延出来，犹如双臂将要被折断。
他的身体，一点点的被压伏下来，不断他如何的咆哮，都是无济于事。
因为那源气大山，似乎还拥有着压制源气的作用，一旦被其接触，便是会被不断的封镇……
源山上下，无数道震撼的目光望着那轻轻巧巧就将秦镇镇压得动弹不得的源气大山，谁都没想到，周元竟然还有这种手段！
他的源纹造诣，竟然达到了这种程度！",1
元尊,第二百六十二章 夭夭出手,"陆玄音也是紧握长剑，居高临下的望着夭夭，唇角的笑容有些玩味，道：“你的源纹造诣虽然不弱，但总归还挡不住我的剑。”
“你刚才是说，输了随我处置吗？”
望着似乎胜券在握的陆玄音，夭夭的神色，倒是依旧平淡，道：“你似乎以为你已经赢了。”
“不是吗？”陆玄音冷笑道，还当夭夭是在逞强。
不过，就在她声音刚落的那一瞬间，其面色陡然一变，因为她见到，那些弥漫的水气，竟是在此时不知不觉的落到了她的身上。
水气瞬间凝结，竟是化为了一条条水蛇，水蛇缠绕而来，将她的双手，双脚都是紧紧捆缚。
陆玄音体内的源气瞬间爆发出来，就要震断这些水蛇，但这些水蛇身躯表面，忽然有着光纹浮现，而陆玄音体内的源气一碰触到那些光纹，竟是犹如被封印一般，迅速的退缩回去。
长长的水蛇缠绕住陆玄音的娇躯，将她双手双腿扯开，犹如大字一般的悬挂在半空中。
水蛇勒紧，水气打湿了衣衫，倒是将那陆玄音玲珑有致的身材给凸显了出来。
陆风等众多圣州本土弟子的大笑声噶然而止，犹如是被捏住了喉咙的鸭子一般，他们望着此时被捆缚起来的陆玄音，一个个的面色，变得无比的精彩下来。
他们的眼中，还有着浓浓的难以置信残留，他们无法想象，身为金带弟子的陆玄音，竟然会被一个外山弟子轻易的制服。
他们惊恐的目光，投向了那漂亮得不像话的夭夭，身体都是在此时微微颤抖起来。
对于他们那些惊恐的目光，夭夭则是未曾理会，她只是抬起眸子，看向那疯狂挣扎的陆玄音，清淡的声音，在楼中响起。
“看来，是你输了……”",1
元尊,第二百六十三章 震慑全场,"带着酒香的水气，弥漫着百香楼中，然而整个楼内，都是一片死寂。
那陆风，杨修，秦镇等人都是眼带骇然的望着眼前陆玄音被捆缚的一幕，手中的酒杯，都是在此时缓缓的滑落，跌碎在地。
谁都没想到，陆玄音，竟然输了！
“怎么可能？！”陆风面色青白交替，难以置信的喃喃道。
其他人看向夭夭的目光，也是犹如见鬼一般，充满着惊惧，要知道，陆玄音可是内山金带弟子，太初境六重天的实力！
如此实力，足以碾压任何外山弟子，就算是陆风，都与其相差甚远。
然而谁能想到，太初境六重天的陆玄音，竟然被夭夭如此轻易的就被制服了？！
那夭夭的实力，究竟是何等的深不可测？
陆风那边骇然惊惧，周元这边，除了他自己外，赵鲲，宋婉溪等人同样是面色精彩，甚至还揉了揉眼睛，以为出现了幻觉。
“小夭师妹这也太恐怖了吧……”赵鲲咽了一口口水，在进入苍玄宗外山后，夭夭很少出手，所以对于她的实力如何，也是无人知晓，但今日这一手，简直是秀得让人头皮发麻。",1
元尊,第二百七十一章 天元进化,"黄金石台上，无数目光汇聚而来，璀璨青色剑光，陡然落下，与那横挥而来的天元笔，重重的撞击在了一起。
嘹亮的金铁之声，响彻天地。
不过，就在巨声响彻的那一霎，陆风的瞳孔，猛然一缩，脸庞上也是一抹骇然之色浮现出来。
因为他见到，在那碰撞的瞬间，青鹰剑竟是剑光一震，发出了一道哀鸣之声，剑光破碎，直接是被那只黑笔，硬生生的轰得倒飞而去。
那种感觉，仿佛周元那黑笔挥下时，携带了无穷之力，恐怖霸道到了极点！
甚至隐隐似有一道鲸吟声响起。
“怎么可能？！”天地间，也是响起了无数难以置信的惊呼声。
甚至连青阳掌教等巨头，都是微微惊咦出声。
而在那无数道骇然目光中，周元则是长长的吐出了一道浊气，他双目炽热，手掌缓缓的抚过斑驳的笔身，在其手掌过处，一道古老的源纹，绽放出了神秘的光芒。
天元笔第四纹，号“万鲸”。",1
元尊,第二百七十三章 九龙之威,"漫天遗憾声中，周元则是神色始终平静，他望着那徐徐压下的青色星辰，已是开始察觉到后者力量的极限。
“只是如此吗？”
“那就该我了！”
他似是自语一声，下一瞬，忽的长啸出声。
啸声如雷，而就在此时，那三道被青色星辰压制的兽影源气，竟也是爆发出了咆哮之声，在那咆哮间，那自其中散发出来的凶暴气息，也是在此时猛然间，节节攀升。
而原本百丈左右的源气，也是陡然膨胀，化为了三百丈左右。
“什么？！”
这突如其来的变故，直接是令得陆风瞳孔一缩：“怎么可能？！他的九龙典明明只是炼化的四品高阶的源兽精血，怎么可能强到这种程度？！”
他也是研究过九龙典的，据说唯有炼化了五品源兽的精血，才有可能令得兽影源气达到三百丈的程度，但他可是清楚的记得，琳琅阁中可并没有五品源兽精血了。
周元面色漠然，他的确只是得到了四品高阶的源兽精血，但借助着吞吞的鲜血，这些四品高阶的源兽精血，却是得到了巨大的提升，完全不逊色真正的五品精血。
“吼！”
三道三百丈的兽影源气爆发出了惊人的力量，只见得它们长尾甩动，竟是缠绕上了三颗源气所化的青色星辰，凶气陡然爆发。
咚！
三颗青色星辰，便是直接在此时爆碎开来，化为了漫天光点。
哗！
漫天哗然声响起，谁都没想到，局面竟是峰回路转，陆风原本的优势，瞬间荡然无存",1
元尊,第二百七十五章 大典第一,"当陆风倒塌的时候，整个天地间，仿佛都是一寂，无数弟子，渐渐的张大了嘴巴，眼中有着震撼的情绪在凝聚出来。
哗！
下一瞬，滔天般的哗然声，便是震耳欲聋般的爆发开来，犹如要掀翻山岳。
谁都没想到，这场争锋，陆风竟然会败了！
“小元哥也太厉害了！”沈万金等人目瞪口呆的望着黄金石台上那道屹立的修长身影，虽说他们一直都期望着周元能够胜出，但他们对于周元的底子并不清楚，所以心头也是忐忑，毕竟陆风以往的威名实在太强了。
所以当陆风倒塌下去的时候，他们受到的冲击相当巨大。
那萧天玄也是面色复杂，看向周元的目光中有着一抹惧意，此时此刻，他倒是有些佩服他父亲的眼力了。
以周元展现出来的天赋，未来必然会是苍玄宗的核心人物，前途无量，到时，恐怕整个苍玄天，都会响彻其名。
此等人物，的确不宜结仇。
顾红衣也是仰起光洁俏脸，她美眸泛着异彩的望着周元的身影，显然这种结果对于她而言，同样是有所震动",1
元尊,第二百七十六章 择峰修行,"他袖袍一挥，只见得一道玄光从天而降，化为一卷古书，古书之上，仿佛有着苍阳升腾，一股极端炽热的气息散发出来，引得虚空都是有些扭曲。
“此为天阳神录，乃是一卷下品天源术。”
此言一出，顿时再度引来了无数哗然声，一道道通红的目光灼灼的望着周元面前悬浮的玄光古书。
竟然是真正的天源术！
要知道，若是在圣州大陆之外，一卷下品天源术，足以成为诸多势力的镇族之宝，甚至引来无数惨烈争夺。
周元也是有些口干舌燥，眼睛盯在那古书上移不开来，这可是真正的天源术啊，要知道，就算是在那圣迹之地中，他都未曾获得如此等级的源术。
虽说他如今也是修炼了一些小天源术，可就算是九龙典，都是远远及不上这“天阳神录”。
而据说，在内山中的藏经楼中，倒是能够兑换天源术，但那所需要的源玉数量极为的庞大，说不得便是需要数万，那显然需要诸多内山弟子努力许久才有可能换到手的。
“谢掌教。”
周元行了一礼，然后小心翼翼的接过这卷古书，将其收入乾坤囊内，满脸的喜色。
青阳掌教一笑，道：“此番第一，还有额外奖励，便是那‘源髓洗礼’，此事待得你进了圣源峰后，自会将名额赏赐于你。”
周元点点头，心头也是有些好奇与期待，毕竟据说那“源髓洗礼”，可是唯有紫带弟子才有资格享受的待遇，对于修炼，大有裨益。",1
